06435719e8e355580bafdd19b7b9af986603e0c5.png	pol	400	w ramach\nwdzięczności za wpuszczenie do ekskluzywnego\nklubu, jakim jest Unia, nowi członkowie odłożą na\nbok swoje interesy i zatroszczą się o interesy innych.\n\nAle teraz okazuje się, że\ndo zdania matury może\nnam zabraknąć wytrwałości. Tracąc grunt pod nogami po lewej stronie sceny politycznej, Miller i Cimoszewicz zdają się pękać i akceptować system\ngłosowania oparty na zasadzie podwójnej większości. Na samej końcówce mogą oblać egzamin.\nGodząc się na kapitulację,\nMiller przejdzie do histo\nrii jako mężczyzna, który\nnie tylko źle zaczyna, ale\ni fatalnie kończy. Wygląda\nna to, że za postkomunistycznych notabli maturę\nbędą musieli powtórzyć\nw referendum wszyscy\nPolacy.\n\nVC
0648a9a0b72a979e357fa0c60df87786ae84b833.png	pol	400	E) 194 j m 033
06da65bb8f4393434a9588420fb58378dcfd057f.png	pol	400	b / sesy ssy 'gemzy Uberrnik\n\n„' [~"j ajzbarw wz oo ;›ł›\n\nz p se p m o\newmremd QWŻ?ź ae Ć -92/2; e 74›2%_;7492/»%\n\nm RD AM/P Q-A P Ip m _I:DAA.MAWJ aABOKOPPRAN ((
0701b001b89bdcaacc609aad79bbfa78cdc74e8f.png	pol	400	J/ EFrVb A J EewWA PĘZ KOTNYM 7Ł c / 0Ś\n\n.................................\n\nSą miejsca i zjawiska, które\ndają ludziom poczucie sta\n- łości i pewności. To np. bi. cie londyńskiego Big Bena,\n. wieża EFiffla w Paryżu czy\nWielki Mur w Chinach.\nW Polsce taką rolę odgrywa\n\n|  głoszony przez Andrzeja\n| — Leppera postulat, iż Pan\n| musi odejść. Dlatego po| czułem, Że ziemia_usuwa\n| . misię spod nógrgdy ostat| nió Lepper łagodził ten po| gląd.Narszczęście wczoraj\nx oznajmił nie tylko, że Pan\nnadal musi odejść, ale że za\n\nX swoje winy powinien Pan\n\n| też do końca życia praco\n. wać W kamlemołomach\n')a; " A_ ni I$\n\n?\n\nPaekl 005 m ZfU( * K
070f97ea92f0cbd18e34710ddbc9e10ea2445273.png	pol	400	Bolesław Mołojec, dowódca XIII Brygady, opisywał w swoich ni gdzie dotąd nie publikowanych\nwspomnieniach zmęczenie żołnierzy: „Skoczyłem na najbardziej opornych, na tych, co to nawet mając siły powiadali, że pierdolą cały świat\ni srają na życie. Chciało mi się ich rozerwać na\ndwoje, zagryźć, jak podłe padalce.... Wiedziałem, że kiedy na górze hukną strzały, nikt najmniejszym ruchem nie zareaguje, że trzeba będzie szarpać ich za ręce, Za głowy, przeklinać,\n. złorzeczyć, obrażać, by z nich przynajmniej złość —\n. wydobyć, którą jch postawi.na.nogi".\n\nTadeusz Zbroiński, „Mongoł” z Będzina, szczególnie zapamiętał front pod Guadalajarą: — Marzec. W dzień deszcz, w nocy śnieg. Woda po\nkostki. Jak kolega zasypiał, to ja manierką wybierałem wodę z okopu. Równina. Nie było gdzie\ngłowy schować. W powietrzu — niemieckie sa- moloty. Mieli wielką przewagę W powietrzu, mie\nli przysłany przez Hitlera Legion Condor. Niebo należało do faszystów.\n\nSr lr Mpórran 1992, my 35-75
071e590e1e87608357743e8c8942aa03398c524c.png	pol	400	©\nZ\n\n \n\nes p\n\n$ X . 1" , o _ .' ” j ś\n_ Nie powinieneś beZ pozwolenia przeglądać cudzych rzeczy — P?x MĄ%&\n3\n\n  \n \n\nwiedział trochę nerwowo ojciec. — Myślę, że pani Helena nie miałaby nic\nprzeciwko temu, ale wypadałoby ją przedtem zapytać...\nŁukaszwww właściwie nie usłyszał»:j '\ngo wcale. mmm\n7. kolejnego arkusza bristolu patrzyła na niego uśmiechnięta twarzyczka. Wraz Z rozsypanymi włosami zajmowała niemal całą powierzchnię\nkartki. Portret najmilszej w świecie osóbki. To znaczy zrobiony przez\nkogoś, komu ta osóbka była najmilszą na świecie. |\nT . -- =\n\np\n\n%\nI- _ 3\n. Febedk. Jmoalowdha z lomh, k f\n, / sz 'XQ%_”QD 3 y E›.A :\nFŻ@JLQ(_ĄH O/e Ą %8 X | y, ż_(QZ Xx_;%»o' Jź/v?] W@d\nssm . _OD... yuode
072377c2e3d9c76c7f811e48efa6377e8e8db3ff.png	pol	400	f;,'.r;;„/uiió l RA Mó. f,fg'\n\n/\n\nLała się woda\n\nWczoraj około godziny 21 .40 pogotowie wodno-kanalizacyjne W Poznaniu\nzostało. postawione na nogi. Przy ulicy\nGmgowmfmmmm\nzarskiego, nastąpiła awaria rury wodociągowej. Ponieważ pęknięta rura była\ndość spora, ulicą zaczął płynąć rozległy\nstrumień. Specjaliści byli na miejscu\nprzed godziną 22 i ocenili, że trzeba zamknąć dopływ wody. W chwili, gdy ni\n; niejszy numer „Głosu” oddawaliśmy do\ndruku, trwało usuwanie awarii.\n\nll saga\n\n \n\nii W7 Óh polaks 2o02/ w 1478/ s. Ż
07384fdeb02dac0eaeaa63f14b4c48b07a1aa880.png	pol	400	NA '\n29 d 10277 / hp 7 % |\n27 sgl Ź jaól MV ! sh- 8lt/ ? ze20Y?\n\n? ( nał JY\n/;4/›9)7? oż ~77/ 2227 Wl/ą/%j ko? ! ]/ą\n3;,2„,;„3/17(„]—/? : /0'2›7'2«\n\n/ /ź]«U'? 27 ] f”//')'f/ / "4/727/%7\n” „/// /y/ź?/V/M/\n\n/ v 5%7 z\n\nu VVlf/ / f”7/02fyól€797 /o//k/ z«ć/yyilź”'l/ "\nMić ya/; Jz'!;v[vś; lą fvzrlm/ y <0 ;7/ / 3/7/?/%/ ]/%/lć wi\n712747—/7/ /y/'bf›ii/a;w/ // .„„ /;?/y;ngy )a // _:7(”1/7\n\n2 M AA / (&7\n„„„ź?› z JW?W@A/ o MW;W n 2pum 99 /] 4/2/71\n\n| „”;mw v 220 mg/ (_')\n\nSY u Łź/\n\nsrauJ fjafm Z ,\n\nf
075c1a011c34a9ca6548b7c2501f9abedca61971.png	pol	400	.\n\n"nyba mało kto zgadmnie,\n4 ilu też ludzi, $pośród\n12 500 zatrudnionych w często'chowskiej Hucie imienia Bolestawa Bieruta -- pracuje hez' pośrednia w mnrodukcji, Otóż\nzaledwie 4500 Mówił o tym\nwytapincz z tamfiejszej stalow\nk\n)\nr\n!\n!\n,\n\nni podczas krajowej narady\naktuwu robotniczeno,  która\nniedawno odbyła się w Warsztawie,\n\nSprawe mocno rozbudowanej\nadministracji podejmowało\ntam zreszta kilkunastu mówców, trnktujacuch zmnmiejsze\nnie liczby ministerstw i likwidację zjednoczeń jako istotny\nkrok, na którym powinny nastąpić kolejne. Mówiono, iŻ\nadministracia nadal zbyt wiele kasztuie Wskazwonno przerosty biurokracji. w poszczeaólnyeh, służbach 1i żi 5'*'«""›\nurzedów, krytykowano przejawWY marnzmu Nieudo Inuvrr\n\n \n\n \n\n  \n\negd .l'l\n\nP SE AE oS SA "Y" """ NZ OD ZE Z ZA, DDD DDD ZRZ\n\n*\n\nŁNamienna KUYUJRNO\n\ni lekceważenia codziennych\nobowiązków przez pracowników administracji, Przy tym\nowe krytyczne wwagi OdNnoszo\nno Zf'll'f›'ll)›lr'› do administracji\ngospodarczej, jak też do admi\n \n\nmmuuummun\n\nnistracji terenowej, W odniesteniu do tej ostakniej oręcz\n"apytywano, czy nie ma sposobu na dostrzeganaą w jej POr\nstępowaniu „Nniemośność” 0oraz\nniekiedu brak konsekwencji.\nTwarde ś szczere Byłuy wypowiedzi robotników. Przytacza\nno przykłacday zmmiejszaniu stę\nliczby zatrudnionych w produkcji przy pozostawaniu na\n\nne\ndy\n\n"mMIENLOTLYM\ntabryczne)\n\npozłomie obsa\nadministracji,\n\n \n\ngrona pmcowmkow bm'rowych „\nprób kończacych się odchodzeniem wrzędników poza macierzystą fab?'ykę, bo niemal\nwszyscy odmawiaja przejścia —\ndo produkcji „nze chcac sobie\nbrudzić rąki. Padł też znamienny wniosek, by dr›i»omr*\npowszechnego pr"!eglądu. z trudnienią w handlu, biuroch\n' imnstytucjach — w celu po20stawienia tam tylko rzeczywiście niezbędnych ludzi.,\nDobrzy, sprawni wrzędnncy\nm. społeczeństwu bandżo potrzebni. Tak jak jest nam niezbedna dobra adrn›nzstmua\nbo bez niej nie może należycie\nJunkejonować organizm oW\nczesnego państwa. Nutommst\nadministracyjne przerosty\n\nkulą u nodi. Warszawska .a=\n"tida aktywu potwierdziła, że\nrobotnicy zdają sobie z tego\ndoskonale sprawę. Dlatego żądaja uporzadkowania tej.sje=\nrY, Zycia\n\nWIESŁAW PORZYCKI\n\n \n  \n \n\n  \n\nŚ:, Wulleds li 1085 e 69 1.
07845101553fdf09815bede4cfa85fc80446389c.png	pol	400	JANCNULWICK lllgl ll_y'l_y 5CLOU VW,\n\nObie strony konfliktu czują się dyskryminowane, obie zapełniają prasę, radio, telewizję, nie mówiąc o Internecie, swoimi oświadczeniami i polemikami. National Parenting\nAssociation (Narodowe Stowarzyszenie Ro\ns»\n, » ? . 4 €\nAR /J B,/ 26 6 d \ndziców) traktuje rodzicielstwo\njako misję. Jego członkowie\noskarżają system i społeczeństwo o ciągłe rzucanie kłód\n\nPOd›aniQ_QmagajEi_się'ć'lĘs&l :\n\ncznego czasu pracy, ulg podatkowych, lepszych szkół, ograniczenia dostępu do broni.\nKrytykują media kształtujące\nnegatywne i agresywne postawywśród młodzieży. Dużo informacji kierowanych jest bezpośrednio do mam, młodych,\nstarszych, mam zbuntowanych nastolatków oraz nasto\nletnich wyrzuconych z domu ,\n\nprzez nietolerancyjnych rodziców. Inna sekcja przeznaczonajest dla ojców, którzy cenny\nczas poświęcają dziecku,\nz którym się wędkuje, gra
07aaa5c0455a2691e521f56eac0c23b0f847751c.png	pol	400	Ą 9:7 s 14 ź'/ / u /'L›L"*We l*\n\n, Separacja Leppera\n1 od Kaczyńskich\n\nKiedy_nadejdzie ten mo\n|\n|\n\n \n\nstm›rzema paktu na rzecz wbiEia osikowego kołka obecnemu\ndowi.\n| Już dziś pubhcysta „Trybuny'\n›nu]e taki oto scenariusz marzeń:\n„socjalliberał Lepper w naturalny\nsposób oddala się od PiS i przybliża do PO i SLD. Te dwie ostatnie\npartie dzieli w gruncie niewiele.\n(...) Socjalliberał Lepper, jak to sobie wyobrażam, poparłby rząd PO\nlub PO—SLD za odpowiednie kon- :\ncesje”. |\n\nZEiii oronina d diii w oo M 1\n\n4 , )*\nkakf Zaogr m JE C
07ce93cc1e4c615e41e1a5e2727e5d5bedacefcb.png	pol	400	/WZÓ&/W›( Ć HNodehMuv\n\n| arosław Kaczyński po wie- | lomiesięcznej bezczynności\n\nurządził wielką manifestację\nsprzeciwu przeciwko reformie\nemerytalnej. Praktycznie jest\nto próba wysforowania się jego\npartii na czoło protestujących.\nA do demonstracji przeciwko,\njak wiadomo,_ rzebierają już\n\na nogami i związkowcy\n\nod pana Guza, i „Solidarność”,\nktóra pierwsza zadęła w surmy\nbojowe i zebrała ponad milion\nczterysta tysięcy podpisów Za referendum w sprawie przedłuż\nnia wieku emerytalnego. W kolejce stoi też Miller, któryoptuje /\nza referendum. pr\n\nTmr- \n \n\n[ki 2O 12 jm 63 $ Ź.
083393627398d8edeef876d66e41a64047e67db5.png	pol	400	k\n\nStrasznie tu wychwalam książkę arcybiskupa Zycińskiego. To prawda, wychwalam, bo cieszę się, że mamy arcybiskupa-publicystę. Wychwalam, zamiast\nsię czepiać drobiazgów, bo się boję, że\nprzenosiny z Tarnowa do Lublina mogą\noznaczać taki wzrost zajęć i Spraw, że przestanie pisać artykuły. Byłaby to wielka\nstrata. Książka ta bowiem pokazuje, w jaki\nsposób Kościół jest znakiem obecności\nTego, który objawił się w krzaku gorejącym. W momentach wielkich przemian —\n\nteraz i w przeszłości — Kościół traci grunt\n\nscir\n\npod nogami, trzęszczy w posadach, wydaje się ginąć i... nie ginie. Bo Kościół to\nkrzak, który płonie ogniem, a nie spala się\nod niego, znak obecności Boga, '\nA wszystko, co w Kościele tym znakiem\nnie jest, to — jak powiada Ksiądz Arcybiskup - folklor. I nie ma się co zbytnio\nprzejmować.\n\nABP JÓZEF ŻYCIŃSKI „NA ZACHÓD OD DOMU\nNIEWOLI”, Wydawnictwo OO. Dominikanów „W drodze”,Poznań 1997.\n\n'(IoaIzp ę zeJo ćąUozgewLQdS/v;\n\nUB G JOMEU 9EPAM oZOW yUEq BJUOY EZOEDEJSOd osolum EN\n\neJp 'du)\n\neotzon Azaizpoju eJp\n\n[eoelniprys qr djs |\n|dźm ewuoj EUpoB/m 08IM O] Jser 'Je| £| AAZ\n\noUoyn\n\noBemoyuozsam Aje\n\nUDAJsIqOsO\n\n92!0P 'Wogoso WAuul Auey sluepAm o 9idejsAm e60w\n\npeisod\n\n1U0 ozoepelsod ojpeuod da OMd M eJsiqoso ojuoy uoAoele\nMOLUIAII ejD wyjsAzsm opozid es auozoeuzszid Auey\n\n€ SAUdSM3 OMd Auey\n\nwozoepersod Jejs0z szou o1y\n\n'e0s|Oq [ejeo M da OMd MojELUONUEq 10Ę\n\npeuodhoals m ezpkiusid 9e0ejdAm eu\n\nzow [omoyueq Aurey koowod e7\n\n9lU (NId) ODANCADWVMI-ALNAGI_|— \nNAAWNN OD3N4NOd euz alu o 'Wwolmog PN Aen [el nypedkzud\nM jeMeu 'OmMjsuozooajldzeq elumedez SA3HdSM3 OMd euey\n\n'9AznJsod tlu dis ozow
0864bcd440b519261c305d44ee58b9bb046b8287.png	pol	400	e Nle chcę byc ńoshwy _ loda|\n\npowie na takie tłum aczenie VVO]-;\n\nciech Smuga — ale inż. Kosobudzki\nd ma chyba przy,›iład na SVJO]EJ osobie,\n ponieważ na osiemnaście lat pracy\n: ma za sobą oslemnacme zakładów\n„kiedy się z nim żegnano zawsze\n\n \n\n \n\nvwvstawiano dobrą opnnę, zeby mogł*\n\n4 .›male Ć sobie pracę...\n\nWojciech Smuga 'tak' *mówi bok,\n"I zdenerwowany jest, WSZYscy tylko\n: *kłorix rzucają mu pod nogi. Woje\n.'Żr.j;';;_ VVÓd?kl mmł 1 na— m\n\nwet sami spółdzielcy, a Komitet |\nGminny PZPR w Silnowie prawie |\nodmówił mu rekomendac31 pahtycz-—,\nnej.\n\n \n\n \n\n \n\nsran yyy RTo : s A J ;\npoogą4o.. . ....... bbvo-bc'ooąl-oobl.. ..6090- - >\n\n \n\n \n\n„,c„ zz;r.;a:":””«w«x s w z Lf« s
086fedbb579440db93ceef609bc9a8012d978fca.png	pol	400	
088159a46882831d0f45c35139ef9510408d3d2b.png	pol	400	"'Ś': K4 s)\n»h e GL ©\nś\n\n  \n\n \n \n\n \n\n \n \n\nPapiey\n\nPaulinka ma 8 lat i jest bardzo samodzielna, ale swoim wyjściem do sklepu postawiła na nogi całą Tubelską policję.\n\nZrozpaczeni rodzice powiadomili policjantów, że\ncóreczka przepadła jak.kamień w wódę. Kilkugodzin- |\nne posztkiwania nic nie!\ndały, pomógł dopiero kierowca miejskiego autobusu. Powiedział, że dowiózł,\ntakie dziecko pod hipermarket. Tam odnalazła się |\n\nA\n\nzagubiona Paulinka wę- '\ndrowniczka. JAG —\n\nT biii p A ł i
088d13ce263bbf4eeac9d04370e432d64523ce86.png	pol	400	* Diderot twierdził, że wszysł\nko jvo się powie o 'kobiecie jest\n\nsłuszne: że jest mądra i że jest\n. glupia, ladna i szpetna, dobra\ni zła. Czy pani też tak sądzi?\n\n— Och, w przyrodzie panuje\ntaka rozmaitość! W każdej z nas\n\ni drzemią złe i dobre duchy..\n\n* Poplotkujmy więc po babsku o dzisiejszej kobiecie. ,\n\n— MNasza kobieta bardzo się\nrozwinęła, ale chyba nie „wyszczęśliwiała”. Nie można powie\nj dzieć, że wraz z emancypacją\n_złapała pana Boga_za nogi! Na|'sze babki sufrażystki dobijały\nsię o zrównanie z mężczyznami,\n\nale nie przewidziały konsekwencji! Cóż z tego, że mamy\nmożliwość kształcenia się, zabie\n rania głosu w parlamencie, by\ncia na stanowisku, kiedy spadło na nas o Wiele więcej obowiązków, niż miałyśmy kiedy\n'kolwiek. W mojej nietypowej\n\nbyć może ocenie tylko kobiety\nwiejskie wygrały: są zadbane,\nmają czas na rozrywki i życie\ntowarzyskie.\n\nd - - .\n\n/>\n'4 l/:)) Ć Ł/(' ę .*/k.l' z ? (..fll' AJ) M 1.›[7 („._›t:\n\nd, / ,\n// LUAZECCA /„',ę' UU .ll'&»\n\n7958 1w 53,5, 9,\n\nWV
08af1518ea96e16e52683654d8cbb480fd601c2d.png	pol	400	- Jakiś czas temu zatrzymano nawet jednego mężczyznę mówi prokurator P. Gomolec. Jednak pokrzywdzona nie rozpoznała w nim napastnika.\n\nOd lipca po Szamotułach\ngrasują też nie zidentyfikowani do dzisiaj ekshibicjoniści.\nJeden z nich obnażył się przed\nMałgorzatą W. Ponieważ nie\nreagował na gwałtowne protesty, przestraszona kobieta\nspuściła ze smyczy psa. Mężczyzna jednak nie zwrócił nawet na ujadające zwierzę uwa|| gi. Zdezorientowana kobieta\nk Wzi%ła nogi za pas.\n[" " Sądząc z opisu osób po\nTraarar vexr rzam rh WYWPrZY TTN A Or arz c\n\n \n\n/ 15921 7 1, si,
08d601b945be61d3a2708417e3c95b4f13a64688.png	pol	400	— Odrzekłem bez namysłu, a powinienem był namyślić się i to długo.\nPolowanie na niedźwiedzie z nagonką w lasach centralnej Rosji nie było rzeczą\nprostą. Łatwiej byłoby na Syberii, ale nie mieliśmy ani ochoty, ani odwagi\ntaszczyć opasłego i rozlazłego Amerykanina na Syberię, nie posiadał fizycznej\nkondycji do zaryzykowania takiej wyprawy. Dowiedziałem się o istnieniu gosp()darstwa /(›(›In;,i( zne g(› |›«›(l 'I'uł.;, W ni('wi( Iki(j (›dl( ;,ł()ś(i nd Kaługi Podeko\n \n\n.....\n\ngłoszone] samowysl.u(,/,.nln(›.su 3„(›.5;›(›dau„/.u| /mm lu›„: .spmedał prLed m1681ącem do kilkunastu cyrków zagranicznych (choć gospodarstwo zoologiczne\nmiało w założeniu obsługiwać tylko cyrki rodzime) wszystkie posiadane okazy\nkróla rosyjskich borów i gór po siedem tysięcy dolarów za niedźwiedzia. Byłem\nbliski desperacji. W pewnej mierze przyszłość (pomyślna) naszej joint venture\nzależała od niedźwiedzia. Kląłem go w myślach, targałem za kłaki, biłem po\npysku szpicrutą, szukając na próżno ujścia dla napięcia nerwowego. W Rosji\njednak, jak wiesz, bez wodki nie razbierosz, zajrzałem więc któregoś wieczoru\ndo starego wodkopoju, gdzie zbierali się codziennie moi przyjaciele i koledzy.\nNazwaliśmy go, na cześć Wieniczki Jerofiejlewa, Moskwa-Pietuszki. Był to\nwłaściwie zamknięty klub ekskluzywny (na wzór angielskich), przyjmowaliśmy\ndoń jedynie osoby zdolne wykazać się znajomością na pamięć, od pierwszej do\nostatniej stronicy, arcydzieła naszej ojczystej literatury. Podczas egzaminu\nwstępnego egzaminator i egzaminowany rozpijali obowiązkowo litr wódki.\n: ji ke ł\n\n6 //f > ?0 9 -śn,ul,z.›„/c /Q.wxynż: Jeedla<c eclz'.\n/,/0[*5//% /ćcctfa›~t- " /995, n- 72,.5,2
08e79345d5d554a12fdb035228583ab1e78be24e.png	pol	400	s '\n\n*\n\n1U LeYN\n\nIMZP.U i\n\ns!\n\n' :3MOqoso 3ueq\n\niuezJeMIazud u BPpOSZ WEZPJAAĄ\nOB3MOJĄEJUCH '|93 JN\nO3seiu / AMOJZ2Od poy\n\n*\n\nJo 3\n\nź\nG\nO\n:\n=\nę\nś\nw\n:\n0\n5\nw\n5\n\n*q:›Auep y
08ecd45e4b202f2c8f3c2efd96627ff7cab2e0db.png	pol	400	ZAkŹ\n\n \n\n:półpracownlka\nLeszka Millera? Nie\nador Iózef [\n\nvl\no takle] decyzji.\nPosłowie SLD będą\ngłosować  wedle\nnowiska komi—
092fcc4b0e8fe7d87e0dc5dca98e06ae6ce176b1.png	pol	400	. WOJA u s\n\n \n\n      \n   \n  \n\n \n   \n   \n  \n    \n\n  \n \n \n\nz Czechami. Selekcjoner biało-czerwonych doskonale zdawał so- |/\nbie sprawę z wagi tego spotkania.\nDlatego chciał zadbać o każdy\nszczegół, który mógłby mieć zna\ndo oklasków. Tak grających Polaków chcemy oglądać zawszel\n\nTo był bardzo ważny mecz dla\nLeo, bo na jego niepowodzenie\nnieprzychylni mu działacze\nz PZPN tylko czekali. Niektórzy\npo cichu zapowiadali nawet zwol- [ kingu FIFA.\nnienie Holendra, jeśli naszej repre- W tyskim hotelu Piramida Beenl zentacjiwmmeezu ||hakker każdą wolną chwilę poświę- |- b\n\n     \n     \n      \n     \n\n| starcia z Ósmym zespołem w ran\n \n     \n  \n   \n \n\n  \n    \n    \n\n \n\nczenie dla końcowego rezultatu | -
0959d0e93fa84314cf6930ae3d51ae40504aaa62.png	pol	400	I[za[eupo al aon›nenus\nsAoel ze1oą e 'ewsid ou\n-urofej ruA3snd eu jemAIyn\n1eq 000T peuod zazid uey/j\n-BMM Azo Jomzafl 19q sndo\noz 'kzIarM oI0SIMAZJ9ZI\nKz1999 'yokumTEU Aunp\neuzou 9Łuskros TUIEBDISĄ\n- oM)]sue(f0goz1y)\n(oz1azs e 'Tomo\n\n   \n\n \n\n_ 8IS AqłeMosalammz em\n03 'MOJTUTEJ AJJ9S OP q:)Ao\n-ezaqjeu 'nyelm III Z MOJ\n-/1s0u8 orusziajM [ordo]\n- 9euzod Awazoui nwuo197Ą\n@\n\n \n\n \n\nDysrzp 4quounyop Amou\nouorzojeupo az 'nisold\nod ouesjideu uoejsześ /\nAqApe 'azperusrd o opjAm\nxe( żrzpoyo wojeż 02 O\n*"OUesIĄ\nuaqdals *0 083uZ9[80]09],\nnjNnjAJsuJ oBap[sa;ded!\n103.91Ap eqsoypod - [or]|\n-pJOJey ofuk1pop M or\nIusTurZ aju oje 'nyolmM JI M\nrzpnI e!ua[gAm Jeu\n-a3 eu dzpojM tzseu JAZI\n-ezsod euo oz0j '[0931M|\noTu T JAIJoOde oyJA1 03 ezs\n\ns\n\nyy\n\nN\n\n.-Epn[ Snłpam epo3ueMĄ —
099cf93b8158765b8345ff1d4d2c249826c8b028.png	pol	400	//Ęb i '/I907\n\np 5'\n\n"rzysząca temu bezbarw\nCena, o której mówiłam\n\n| politykom PiS, zanim za\nwarli koalicję, okazała się\ndużo wyższa, niż WsZzyscy\nprzewidywali. Także dla\nsamej partii Jarosława Ką- w\nczyńskiego. Koalicjanci są |\ndla nich kul ogi. Towa\n   \n\nność nowej minister spraw\nzagranicznych i coraz wYyraźniejsze wewnętrzne po- sy\ndziały w PiS (nawet Michał S\nKamiński przyznaje, że '\noskarżenia wobec niego\n\nmogły wyjść z jego partii)\n\ndodatkowo wpływają na\n\nobniżenie poparcia dla Prą\nWa i Sprawiedliwości. Wiel\nka szkoda, że tak się dzieje,\n\nbo projekt naprawy pań\nstwa, którego gwarantem\n\nmiał być PisS, jest wciąż ko- |\n\nnieczny.
09ad81abc22a225d2a490cd67e5fbf602507578c.png	pol	400	d eu Bpo8z WEZEJAAĄ\n'** OSBMOJĄEJUCH '[93 UN\n"""* OWJSIMZEU | SIWJ\n\nys bysjog b3Ey2 zozud y>4moOBUNayJEW UJEJDD M\n\n.se..oe..\n\n \n\n........\n\nUJAMOGOSO UDAUEP UDJOLU DIUPZIEMIOZJ\n\n..se..e.ose......\n\n \n\n \n\n2220292+ 004?900$s0000042$$$0$$sooserecosoosocroooesoerocesesene*es*<<-*> OĘSE!LU / AMOIZDOd PO›[\n\n9250004024* .\ns. $5.4..0............E.OŁ e ..osO.ce...oo.ecooa................... . .......... Ju ł Ealln\n\nseszere.se.ez...\n\n.......\n\n \n\n  \n\n%? ' se PW li c | z % &;\na wmu\n\n. wuata Ze SObą bardzo ciężką tor\ną bę, a mąż odprowadził ją\n\nź na przystanek PKS. Urlop spę\ndzał jak każdy. Opiekował się\n\ndziećmi, chodził z najmłodszym |\nsynem na plac zabaw przed blo; kiem. Dzieci normalnie chodziły\n- do szkoły, a jego najczęściej widywano w sklepie. - Kompletnie\nnic nie wskazywało na to, co się\nwydarzy. Zachowywał się nor” Nmalnie — mówi jeden z sąsiadów.\ndo telefonu od Iwony.\n/W czwartek żona musiała powieAdzieć mu coś, co zwaliło go z nóg.\nednemu ze znajórmych miał poiedzieć, że pokłócił się z Iwoną.\n\n \n\nb\n%\n\n   \n \n  \n\nR\n\n \n\nZ uki ze0śr mr 27 7, 3
09e7233e9d6de0984e6145a277397d99306bd5c9.png	pol	400	Nie dajemy się wciągnąć w awantury\ni konflikty międzynarodowe. Nie wysyłamy\nnaszych chłopców na obce wojny (Szwajcaria uczestniczyła jednak w wielu międzynarodowych misjach pokojowych). Nie atakujemy nikogo, ale każdy zdolny do noszenia broni mężczyzna idzie na przeszkolenie\nwojskowe i trzyma mundur, karabin i amunicję w domu (7-milionowa Szwajcaria może wystawić 400-tysięczną armię, budżet\nobronny w 2001 r. - 2,8 mld dol.). Nie poddamy się dyktatom ani knowaniom potęg\ntego świata, zwłaszcza wielkich mocarstw,\nUnii Europejskiej i NATO.\n\nONZ? A po co? To kolos na glinianych\nnogach: nieskuteczny, za to szalenie kosztowny. Członkostwa chce elita polityki\ni dyplomacji, ludzie związani z międzynarodowym establishmentem. Kierują nimi\nnie interes narodowy ani wzgląd na wolę\nludu, lecz ambicje osobiste i układy z potężnymi grupami nacisku i interesu. Karta\n\n: ,%5 Ś:UY 7 4 f JŻ 'N cf[g„ ;/4 L// aUO 7@”(„/„_ j\n| a :\n\n \n\n| Narodów Zjednoczonych dopuszcza użycie\n\nsiły za zgodą Rady Bezpieczeństwa. Szwajcaria nie będzie należała do stałych członków Rady, a to oni są faktycznym szefem\nONZ. Mogą uwikłać Szwajcarię w konflikty\nzbrojne, co jest sprzeczne ze szwajcarską\nkonstytucją, gwarantującą neutralność wieczystą, niezaangażowaną, zbrojną i swo\nbodnie wybraną.
09fc2a7a4a36b442d2cb8f55a0af3dcda00fb729.png	pol	400	r ieaydhol - © sb esi dh c e o e erytown fi WŁ c ssch 7eś * b g rad e Fu PP\n""" | -nową były jego książki, mówą że nie ' 9 e Kr\n* widział „Lotu nad kukułczym gnia- s. (R I O "\n....... zdem”. Co nie znaczy, że nie interesu- : : y (\n| jesię sztuką. Międzyrzecki z legendar- m . :\n\nną postacią amerykańskiej kontrkultu- * K AU\n\noro.0osesesee.epornronornoye ... .oo4.0.0oooo0%............... ... .. ...\n\n”" ryrozmawiał między innymi o Amster- " U b\n© damiei Rembrandcie. I może także za- | „„Av %M ” /( ee /L @ /( e sewŁ\n---- zdrościł mu trochę wolności od preze- ---.-.-.....-------”-eeenenencenenneneeceśrerenrneeneenśecentoeedfeene\n* - sowania, jeźdżenia na kongresy, repre- _, , s WA FG\n\n! zentowania, którego sam musiał niekie- ___- 7 JELre, /(MŻJ |\n\ndy mieć powyżej uszu. Chociaż z taką B O\n. wytrwałością, nicomal do ostatniego . K : ee\nE '- tchu, pracował w PEN Clubie, witał £-----------+---------... eeer o eee eee ee eee „\n| i żegnał gości, wręczał nagrody, nie wy- ' | ' ' ' :\n| migiwał się od ciężkiej harówki. Obda- _\n \n\n1079 .09900%20no.n.-z.nonaroc.00.-.n..oo.o.rorooeno0.zo.wo..0...o.o... ooo nee.o..\n\n \n\n \n\n \n\n \n\n \n\n| rowywał własnym czasem wielu ludzi, n . ! ›\nnawet do natrętów miał świętą cierpli- —- ń , I A\nwość. A wszystko to robił z taką ele- ' „ : ne : ”\n- gancką naturalnością, jakby był słowi- — . R 6\neee kiem, który śpiewa w Europiei drozdem ... '\n\n. ciągnącym swe nuty w Ameryce.\n|\n\n \n\n \n\n \n\n \n\n \n\n \n\n//Ó)n;z[a /5(7%[& 574% l«ff?;w[&„_ [Ja L;Wf;/;?@?'ó%/\n106 (x ” s
0a12f28f80d9b5e487a141b194fc523c7a0b5eb4.png	pol	400	O . n\nwa ›U%B' A_ %5DT.\n\n0\nWU \n4\n\n(\n\nchetną postawą byk niezwykle się spodobał, zbliżyła się\ndo niego i zaczęła go pieszczotliwie głaskać po pysku\ni głowie. Wreszcie spokojne, łagodne zwierzę położyło się\nobok niej na piasku, przytulając ciepły, miękki bok do jej\nnóg. Królewna, ujęta jego nadzwyczaj przyjaznym zachowaniem, w końcu usiadła mu na grzbiecie, chcąc przez\nto po części wzbudzić podziw towarzyszek dla swojej\nodwagi. Wówczas stało się coś zupełnie nieoczekiwanego.\nByk w jednej chwili_zerwał się z piasku na równe nogi\ni ruszył galopem ku morzu. Europa, uczepiona kurczowo
